{
  "schema_version": "zmd_doc_policy_v1",
  "policy_id": "docs.project_manual",
  "description": "Explicit lifecycle and responsibility contracts for every depth-1 project-manual page.",
  "defaults": {
    "document_class": "unmanaged",
    "authority_role": "none",
    "mutation": "direct",
    "context_level": "L0",
    "purpose": "No project-manual responsibility has been declared. Add an explicit rule before adding Markdown here.",
    "volatile_facts": "not_applicable",
    "invariant_refs": [
      "DOC-INV-012"
    ],
    "after_change": [
      "docsystem.doctor"
    ],
    "review_policy": {
      "at_phase_boundary": false,
      "max_interval_days": null
    },
    "section_refs": []
  },
  "rules": [
    {
      "id": "manual_historical_snapshots",
      "match": {
        "paths": [
          "03_paradigm_death_baseline.md",
          "07_historical_review.md",
          "08_phase_1_2_plan.md",
          "09_phase_1_3_plan.md",
          "10_phase_1_5_plan.md",
          "13_schedule_estimate.md",
          "20_skip_directions.md",
          "25_autonomy_campaign_plan_20260720.md",
          "p1_2_supervisor_detailed_design.md",
          "p1_2_supervisor_redesign_draft.md",
          "soundness_gap_roadmap.md"
        ]
      },
      "set": {
        "document_class": "historical_evidence",
        "authority_role": "evidence_only",
        "mutation": "immutable",
        "context_level": "L0",
        "purpose": "Closed phase plan, dated design, retired-direction baseline or historical snapshot retained as evidence.",
        "volatile_facts": "source_allowed",
        "invariant_refs": [
          "DOC-INV-002",
          "DOC-INV-012"
        ],
        "review_policy": {
          "at_phase_boundary": false,
          "max_interval_days": null
        },
        "section_refs": [
          "project-manual"
        ]
      },
      "rationale": "These documents record an earlier state and must not be synchronized to CURRENT."
    },
    {
      "id": "manual_chronology",
      "match": {
        "path": "HISTORY.md"
      },
      "set": {
        "document_class": "historical_evidence",
        "authority_role": "evidence_only",
        "mutation": "append_only",
        "context_level": "L0",
        "purpose": "Append-only chronology and historical navigation; old entries retain their time meaning.",
        "volatile_facts": "source_allowed",
        "invariant_refs": [
          "DOC-INV-002",
          "DOC-INV-012"
        ],
        "review_policy": {
          "at_phase_boundary": true,
          "max_interval_days": null
        },
        "section_refs": [
          "project-manual",
          "history-archive"
        ]
      },
      "rationale": "Chronology grows by dated append, never by rewriting earlier narrative to match the present."
    },
    {
      "id": "manual_story_chronology",
      "match": {
        "path": "22_project_journey_plain_language.md"
      },
      "set": {
        "document_class": "historical_evidence",
        "authority_role": "evidence_only",
        "mutation": "governed",
        "context_level": "L0",
        "purpose": "Historical story chronology whose dated chapters remain append-only while its title, narrative cutoff and self-identification header stay maintainable.",
        "volatile_facts": "source_allowed",
        "invariant_refs": [
          "DOC-INV-002",
          "DOC-INV-012"
        ],
        "review_policy": {
          "at_phase_boundary": true,
          "max_interval_days": null
        },
        "section_refs": [
          "project-manual",
          "history-archive"
        ]
      },
      "rationale": "The file's own maintenance convention requires the narrative cutoff to advance after major milestones, and the owner's 2026-08-21 naming instruction requires the maintained title and self-identification; prior chapters still change only through appended corrections."
    },
    {
      "id": "manual_compatibility_redirects",
      "match": {
        "paths": [
          "00_master_roadmap.md",
          "05_open_questions.md",
          "06_current_status.md",
          "21_glossary.md",
          "27_status_dashboard.md"
        ]
      },
      "set": {
        "document_class": "generated_projection",
        "authority_role": "projection_only",
        "mutation": "generator_only",
        "context_level": "L0",
        "purpose": "Generated compatibility redirects to unique current, future, terminology or open-question successors.",
        "volatile_facts": "forbidden",
        "invariant_refs": [
          "DOC-INV-001",
          "DOC-INV-004",
          "DOC-INV-013",
          "DOC-INV-014"
        ],
        "after_change": [
          "docsystem.render_guidance",
          "docsystem.doctor"
        ],
        "review_policy": {
          "at_phase_boundary": true,
          "max_interval_days": null
        },
        "source_paths": [
          "data/repository_governance/document_system/entrypoints.json",
          "devtools/docctl.py"
        ],
        "generator_action": "docsystem.render_entrypoints",
        "adr_refs": [
          "DOC-ADR-010"
        ],
        "section_refs": [
          "project-manual"
        ]
      },
      "rationale": "Old numbered paths remain stable, but their bodies are generated from the single entrypoint registry."
    },
    {
      "id": "future_only_roadmap",
      "match": {
        "path": "ROADMAP.md"
      },
      "set": {
        "document_class": "living",
        "authority_role": "current_guidance",
        "mutation": "direct",
        "context_level": "L0",
        "purpose": "Future-only roadmap with dependencies and exit evidence, excluding current-state copies.",
        "volatile_facts": "forbidden",
        "invariant_refs": [
          "DOC-INV-001",
          "DOC-INV-007",
          "DOC-INV-012",
          "DOC-INV-014"
        ],
        "required_reads": [
          "docs/CURRENT.md",
          "docs/OPEN_QUESTIONS.md"
        ],
        "after_change": [
          "knowledge.check",
          "docsystem.doctor"
        ],
        "review_policy": {
          "at_phase_boundary": true,
          "max_interval_days": 60
        },
        "section_refs": [
          "project-manual"
        ]
      },
      "rationale": "Roadmap says what remains and how it exits; CURRENT and ledgers say what is true now."
    },
    {
      "id": "stable_go_contract",
      "match": {
        "path": "12_go_criteria.md"
      },
      "set": {
        "document_class": "normative",
        "authority_role": "normative_input",
        "mutation": "governed",
        "context_level": "L1",
        "purpose": "Stable vocabulary and evidence contract for GO, close and release judgments.",
        "volatile_facts": "forbidden",
        "invariant_refs": [
          "DOC-INV-001",
          "DOC-INV-006",
          "DOC-INV-009",
          "DOC-INV-012",
          "DOC-INV-014"
        ],
        "required_reads": [
          "docs/CURRENT.md",
          "PROJECT_LOCK.md"
        ],
        "after_change": [
          "knowledge.check",
          "docsystem.doctor",
          "docsystem.tests"
        ],
        "review_policy": {
          "at_phase_boundary": true,
          "max_interval_days": 60
        },
        "section_refs": [
          "project-manual",
          "certification"
        ]
      },
      "rationale": "The criteria remain normative while dated status and test counts live in their unique sources."
    },
    {
      "id": "manual_normative_contracts",
      "match": {
        "paths": [
          "01_overview.md",
          "23_rule_cut_evolution_protocol.md",
          "24_repository_asset_governance.md",
          "26_rules_handbook.md",
          "REASONING_METHOD.md"
        ]
      },
      "set": {
        "document_class": "normative",
        "authority_role": "normative_input",
        "mutation": "governed",
        "context_level": "L1",
        "purpose": "Current semantic, rule, asset-governance or reasoning-method contract.",
        "volatile_facts": "reference_only",
        "invariant_refs": [
          "DOC-INV-001",
          "DOC-INV-006",
          "DOC-INV-009",
          "DOC-INV-012",
          "DOC-INV-014"
        ],
        "required_reads": [
          "docs/CURRENT.md"
        ],
        "after_change": [
          "knowledge.check",
          "docsystem.doctor",
          "docsystem.tests"
        ],
        "review_policy": {
          "at_phase_boundary": true,
          "max_interval_days": 90
        },
        "section_refs": [
          "project-manual"
        ]
      },
      "rationale": "These documents carry current normative meaning and require governed, atomic updates."
    },
    {
      "id": "manual_current_guides",
      "match": {
        "paths": [
          "02_mathematical_foundations.md",
          "04_design_invariants.md",
          "11_dependency_graph.md",
          "14_risk_rollout.md",
          "15_workflow_testing.md",
          "16_workflow_review.md",
          "17_workflow_telemetry.md",
          "18_workflow_env_config.md",
          "19_implementation_rhythm.md",
          "28_pitfalls_and_sop.md",
          "29_solving_methodology_skill.md"
        ]
      },
      "set": {
        "document_class": "living",
        "authority_role": "explanatory",
        "mutation": "direct",
        "context_level": "L0",
        "purpose": "Current explanatory, workflow, risk or SOP guide; volatile state is referenced.",
        "volatile_facts": "reference_only",
        "invariant_refs": [
          "DOC-INV-001",
          "DOC-INV-007",
          "DOC-INV-009",
          "DOC-INV-012",
          "DOC-INV-014",
          "DOC-INV-017"
        ],
        "after_change": [
          "knowledge.check",
          "docsystem.doctor",
          "docsystem.gate"
        ],
        "review_policy": {
          "at_phase_boundary": true,
          "max_interval_days": 60
        },